query,description
"Can you tell me about SpaceX's first orbital rocket?","The Falcon 1 was SpaceX's first orbital rocket, a small and privately developed liquid-fueled rocket. It had two successful flights out of five attempts."
"What's special about the Falcon 9's reusability?","Falcon 9 is known for its reusability, with the first stage capable of landing back and being reused multiple times. It's designed and manufactured by SpaceX for the reliable and safe transport of satellites and the Dragon spacecraft into orbit."
"Describe the Falcon Heavy's capabilities.","Falcon Heavy is a variant of the Falcon 9 launch vehicle. It consists of a strengthened Falcon 9 rocket core with two additional Falcon 9 first stages as strap-on boosters. It's one of the most powerful rockets in operation."
"How is Starship designed for future Mars missions?","Starship is a fully reusable spacecraft and second stage of the Starship system, developed by SpaceX. It's specifically designed for missions to Mars and beyond, and can also serve a variety of other purposes including satellite deployment and lunar missions."
"Which spacecraft did SpaceX develop for cargo and crew missions?","Dragon is a family of spacecraft developed by SpaceX. The original Dragon spacecraft was the first commercial spacecraft to deliver cargo to the International Space Station. The Dragon 2 version is capable of carrying up to 7 astronauts."
"What was the purpose of the Starhopper tests?","Starhopper is an early prototype of the Starship spacecraft. It was used for short test flights to demonstrate vertical takeoff and landing capabilities."
"Which booster will Starship use for heavy payloads?","Super Heavy is the booster component of the Starship system. It's designed to carry Starship to orbit and is fully reusable."